{
  "host_id": "fixture-host",
  "adapter_id": "test-adapter",
  "observed_at": "2026-08-24T00:00:00Z",
  "available_models": [
    {
      "id": "model-alpha",
      "state": "available",
      "evidence": {
        "kind": "host-runtime",
        "locator": "session model",
        "observed_at": "2026-08-24T00:00:00Z"
      }
    }
  ],
  "supported_effort_values": ["low", "high"],
  "capabilities": {
    "model_selection": {
      "state": "unavailable",
      "evidence": {
        "kind": "host-runtime",
        "locator": "agent API",
        "observed_at": "2026-08-24T00:00:00Z"
      }
    },
    "subagents": {
      "state": "unavailable",
      "evidence": {
        "kind": "host-runtime",
        "locator": "agent API",
        "observed_at": "2026-08-24T00:00:00Z"
      }
    },
    "threads": {
      "state": "unavailable",
      "evidence": {
        "kind": "host-runtime",
        "locator": "agent API",
        "observed_at": "2026-08-24T00:00:00Z"
      }
    },
    "parallelism": {
      "state": "unavailable",
      "evidence": {
        "kind": "host-runtime",
        "locator": "agent API",
        "observed_at": "2026-08-24T00:00:00Z"
      }
    },
    "concurrency": {
      "state": "unavailable"
    },
    "reasoning": {
      "state": "available",
      "evidence": {
        "kind": "host-runtime",
        "locator": "agent API",
        "observed_at": "2026-08-24T00:00:00Z"
      }
    }
  }
}
